{
  "$schema": "https://json-schema.org/draft/2020-12/schema",
  "$id": "https://appsdk.local/contracts/records/worktree-record.schema.json",
  "type": "object",
  "required": ["worktree_id", "issue_id", "module_id", "base_ref", "base_commit", "branch", "head_commit", "initial_clean", "final_clean", "isolation_mode", "scope_hash", "created_at"],
  "properties": {
    "worktree_id": {"type": "string"}, "milestone_id": {"type": "string"}, "issue_id": {"type": "string"}, "module_id": {"type": "string"}, "base_ref": {"type": "string"}, "base_commit": {"type": "string"}, "branch": {"type": "string"}, "head_commit": {"type": "string"}, "initial_clean": {"const": true}, "final_clean": {"const": true}, "isolation_mode": {"const": "isolated_worktree"}, "scope_hash": {"type": "string"}, "created_at": {"type": "string"}
  }
}
